{
  "schema_version": 1,
  "schema": "rtl-advisor-workflow-batch-manifest-v1",
  "document_type": "rtl-advisor.workflow.batch-manifest",
  "items": [
    {
      "item_id": "g01",
      "input": {
        "kind": "generated_rtl",
        "path": "/Users/peter/Desktop/rtl-advisor/experiments/plugin-abc-v1/cases/generated/g01_add8_left.sv",
        "top": "g01_add8_left"
      },
      "objective": "balanced",
      "expected_source_sha256": "6d0567dc6d51a61a375d96afb0318456aed98864fe8b97ffb0ae739163389f68"
    },
    {
      "item_id": "g02",
      "input": {
        "kind": "generated_rtl",
        "path": "/Users/peter/Desktop/rtl-advisor/experiments/plugin-abc-v1/cases/generated/g02_add32_five.sv",
        "top": "g02_add32_five"
      },
      "objective": "balanced",
      "expected_source_sha256": "6b6a194bed066969259d9b93a18469c0bba26a7d89ff2a803f820294289c854c"
    },
    {
      "item_id": "g03",
      "input": {
        "kind": "generated_rtl",
        "path": "/Users/peter/Desktop/rtl-advisor/experiments/plugin-abc-v1/cases/generated/g03_mixed_safe_add.sv",
        "top": "g03_mixed_safe_add"
      },
      "objective": "balanced",
      "expected_source_sha256": "30162d495549647c477decd0b691b5e2dcb18b9b56edd3bd000851e511097998"
    },
    {
      "item_id": "g04",
      "input": {
        "kind": "generated_rtl",
        "path": "/Users/peter/Desktop/rtl-advisor/experiments/plugin-abc-v1/cases/generated/g04_mixed_procedural_add.sv",
        "top": "g04_mixed_procedural_add"
      },
      "objective": "balanced",
      "expected_source_sha256": "d41c31a3112e798bd67ab057e52043949e3f0b0ed10526be7e62daaa74fa2dfc"
    },
    {
      "item_id": "g05",
      "input": {
        "kind": "generated_rtl",
        "path": "/Users/peter/Desktop/rtl-advisor/experiments/plugin-abc-v1/cases/generated/g05_mux_common_logic.sv",
        "top": "g05_mux_common_logic"
      },
      "objective": "balanced",
      "expected_source_sha256": "62594ad1604fbb46bf32eb1b875af6325effb07ca9f9357994a567172e6a0dac"
    },
    {
      "item_id": "g06",
      "input": {
        "kind": "generated_rtl",
        "path": "/Users/peter/Desktop/rtl-advisor/experiments/plugin-abc-v1/cases/generated/g06_priority_decode.sv",
        "top": "g06_priority_decode"
      },
      "objective": "balanced",
      "expected_source_sha256": "66994157674f3bfdecb558a82d23c677e36747ea6524cfb643254207141d4669"
    },
    {
      "item_id": "g07",
      "input": {
        "kind": "generated_rtl",
        "path": "/Users/peter/Desktop/rtl-advisor/experiments/plugin-abc-v1/cases/generated/g07_width_truncation.sv",
        "top": "g07_width_truncation"
      },
      "objective": "balanced",
      "expected_source_sha256": "fb0edeead88d4382e1ccb2d1fe79bc76dc62a7c6c6d7f57540c5a6033f7f93a2"
    },
    {
      "item_id": "g08",
      "input": {
        "kind": "generated_rtl",
        "path": "/Users/peter/Desktop/rtl-advisor/experiments/plugin-abc-v1/cases/generated/g08_signed_chain.sv",
        "top": "g08_signed_chain"
      },
      "objective": "balanced",
      "expected_source_sha256": "b012fa81c56e0e2a101f605b9b8f00de337063c29d9217c8ffd020b767372d6d"
    },
    {
      "item_id": "g09",
      "input": {
        "kind": "generated_rtl",
        "path": "/Users/peter/Desktop/rtl-advisor/experiments/plugin-abc-v1/cases/generated/g09_already_balanced.sv",
        "top": "g09_already_balanced"
      },
      "objective": "balanced",
      "expected_source_sha256": "c1bbfbc8ffc8ea0b18fdfa3ddaa621171e513d51a285aebde8181059ac7a1ff0"
    },
    {
      "item_id": "g10",
      "input": {
        "kind": "generated_rtl",
        "path": "/Users/peter/Desktop/rtl-advisor/experiments/plugin-abc-v1/cases/generated/g10_function_boundary.sv",
        "top": "g10_function_boundary"
      },
      "objective": "balanced",
      "expected_source_sha256": "1c6e1897b1d3edb5da2142d414fe3991523a6159dfa6228512c6acbd09342ca5"
    },
    {
      "item_id": "g11",
      "input": {
        "kind": "generated_rtl",
        "path": "/Users/peter/Desktop/rtl-advisor/experiments/plugin-abc-v1/cases/generated/g11_one_stage_stream.sv",
        "top": "g11_one_stage_stream"
      },
      "objective": "balanced",
      "expected_source_sha256": "1c7e7a24c9db1fca9787798b355b2d9fca354646df1e056c229c658a3a8d36c6"
    },
    {
      "item_id": "g12",
      "input": {
        "kind": "generated_rtl",
        "path": "/Users/peter/Desktop/rtl-advisor/experiments/plugin-abc-v1/cases/generated/g12_two_stage_pipeline.sv",
        "top": "g12_two_stage_pipeline"
      },
      "objective": "balanced",
      "expected_source_sha256": "c20e3160ee51844f00d6ac50b71817dfe21e9d1bb9672e72210885fbf880d58d"
    },
    {
      "item_id": "o01",
      "input": {
        "kind": "explicitly_approved_open_rtl",
        "path": "/Users/peter/Desktop/rtl-advisor/corpus/upstream/opentitan/hw/ip/prim/rtl/prim_arbiter_ppc.sv",
        "top": "prim_arbiter_ppc"
      },
      "objective": "balanced",
      "expected_source_sha256": "20c831d4b8b8d7d9ef87bcd24f1b6dd0c5a4db95acc8ce1feb0ac75505016e99"
    },
    {
      "item_id": "o02",
      "input": {
        "kind": "explicitly_approved_open_rtl",
        "path": "/Users/peter/Desktop/rtl-advisor/corpus/upstream/opentitan/hw/ip/prim/rtl/prim_fifo_sync.sv",
        "top": "prim_fifo_sync"
      },
      "objective": "balanced",
      "expected_source_sha256": "2655befe56a70ee672c2f1259a82ef2beb2adf429ed0405bcf26bea7c4de3630"
    },
    {
      "item_id": "o03",
      "input": {
        "kind": "explicitly_approved_open_rtl",
        "path": "/Users/peter/Desktop/rtl-advisor/corpus/upstream/opentitan/hw/ip/prim/rtl/prim_count.sv",
        "top": "prim_count"
      },
      "objective": "balanced",
      "expected_source_sha256": "b48580aefff674a48a674489c9b21a98d5399ca5b4c7623f3a7c907a75d8f0cb"
    },
    {
      "item_id": "o04",
      "input": {
        "kind": "explicitly_approved_open_rtl",
        "path": "/Users/peter/Desktop/rtl-advisor/corpus/upstream/opentitan/hw/ip/prim/rtl/prim_packer_fifo.sv",
        "top": "prim_packer_fifo"
      },
      "objective": "balanced",
      "expected_source_sha256": "99aeb7564474111dc6662488c9f4ca6b788723e449b128d08ac54f8fc2da5cd2"
    },
    {
      "item_id": "o05",
      "input": {
        "kind": "explicitly_approved_open_rtl",
        "path": "/Users/peter/Desktop/rtl-advisor/corpus/upstream/common_cells/src/spill_register.sv",
        "top": "spill_register"
      },
      "objective": "balanced",
      "expected_source_sha256": "97bf85128f538c54c749896b8eee5fcfe4b27c16845d2a17990979a63b09f2ec"
    },
    {
      "item_id": "o06",
      "input": {
        "kind": "explicitly_approved_open_rtl",
        "path": "/Users/peter/Desktop/rtl-advisor/corpus/upstream/common_cells/src/stream_register.sv",
        "top": "stream_register"
      },
      "objective": "balanced",
      "expected_source_sha256": "2e0e5b6d09ce4ade0881938ee042dcbc78438638fa2592338a374f88a3c27304"
    },
    {
      "item_id": "o07",
      "input": {
        "kind": "explicitly_approved_open_rtl",
        "path": "/Users/peter/Desktop/rtl-advisor/corpus/upstream/common_cells/src/fifo_v3.sv",
        "top": "fifo_v3"
      },
      "objective": "balanced",
      "expected_source_sha256": "861ea44cbd3129731b77977da36fb0dac1a1350d7df664a1b4310423e7d272bc"
    },
    {
      "item_id": "o08",
      "input": {
        "kind": "explicitly_approved_open_rtl",
        "path": "/Users/peter/Desktop/rtl-advisor/corpus/upstream/common_cells/src/rr_arb_tree.sv",
        "top": "rr_arb_tree"
      },
      "objective": "balanced",
      "expected_source_sha256": "f72bc188ea8253230a722bfb6436ab31b6e41c26020fa4ba4eebd93025984f7e"
    },
    {
      "item_id": "o09",
      "input": {
        "kind": "explicitly_approved_open_rtl",
        "path": "/Users/peter/Desktop/rtl-advisor/corpus/upstream/common_cells/src/stream_mux.sv",
        "top": "stream_mux"
      },
      "objective": "balanced",
      "expected_source_sha256": "865fe908c738eb54ad1721666d877a1cccb698f975fbd3385f71b948426d245f"
    },
    {
      "item_id": "o10",
      "input": {
        "kind": "explicitly_approved_open_rtl",
        "path": "/Users/peter/Desktop/rtl-advisor/corpus/upstream/verilog-axis/rtl/axis_register.v",
        "top": "axis_register"
      },
      "objective": "balanced",
      "expected_source_sha256": "599fde2d6c2d806643bbffb7c444297e69a71871f962d4b741ec1914342e0d39"
    },
    {
      "item_id": "o11",
      "input": {
        "kind": "explicitly_approved_open_rtl",
        "path": "/Users/peter/Desktop/rtl-advisor/corpus/upstream/verilog-axis/rtl/axis_pipeline_register.v",
        "top": "axis_pipeline_register"
      },
      "objective": "balanced",
      "expected_source_sha256": "89bcac460e3822dbbed3f2dbd4d9902faac1262d9dcad867b39c97a6f4402fcc"
    },
    {
      "item_id": "o12",
      "input": {
        "kind": "explicitly_approved_open_rtl",
        "path": "/Users/peter/Desktop/rtl-advisor/corpus/upstream/verilog-axis/rtl/axis_pipeline_fifo.v",
        "top": "axis_pipeline_fifo"
      },
      "objective": "balanced",
      "expected_source_sha256": "a7cdccbf905c3f95d4a626fe77d84879a09c3f472dffc5ea2eb7acc9ba113c02"
    }
  ]
}
